{
  "$schema": "https://json-schema.org/draft/2020-12/schema",
  "$id": "https://colonel-byte.github.io/ansible-collection-zarf/schema/package-resources-schema.json",
  "$defs": {
    "Project": {
      "properties": {
        "path": {
          "type": "string",
          "description": "Path is the subdirectory under the package's upstream/ tree.",
          "examples": [
            "core"
          ]
        },
        "component": {
          "type": "string",
          "description": "Component is the zarf component in the package's zarf.yaml whose images are refreshed from\nthese manifests. It is named here rather than inferred, because the mapping is the one thing\na reader of either file cannot work out from the other.",
          "examples": [
            "fluxcd-core"
          ]
        },
        "imageless": {
          "type": "boolean",
          "description": "Imageless says this project's manifests deploy no containers, so `zarf dev find-images`\nreporting none for its component is the right answer rather than a misconfiguration.\n\nIt is declared rather than inferred because the two cases look identical from the outside:\na component genuinely carrying only CustomResourceDefinitions, and a component whose name\nhere no longer matches anything in zarf.yaml. Treating an empty result as acceptable for\nevery project would turn a renamed component into a package that quietly stops carrying its\nimages -- which fails on an air-gapped cluster, at deploy time, with nothing to pull from."
        },
        "match": {
          "items": {
            "type": "string"
          },
          "type": "array",
          "description": "Match are the filenames to take out of the release asset, which is also the resource list of\nthe generated kustomization and so the order the manifests are applied in.\n\nThey are exact names rather than globs. The upstream archive is a flat handful of files whose\nnames are part of its interface, and a glob that silently stops matching -- because upstream\nrenamed one -- produces a component that deploys less than it used to and fails nothing.\nA name that is not in the archive is an error.\n\nOn the tree source they are paths relative to Resources.Tree, because a source tree has\ndirectories where an archive is flat. The file is still written out under its basename."
        }
      },
      "additionalProperties": false,
      "type": "object",
      "required": [
        "path",
        "component",
        "match"
      ],
      "description": "Project is one subdirectory of vendored manifests, and the zarf component that deploys it."
    }
  },
  "properties": {
    "$schema": {
      "type": "string",
      "description": "Schema is the generated JSON Schema this file validates against, as a relative path. It is\nhere because Load rejects unknown fields and would otherwise refuse the key; it exists for\nthe editor and the check-jsonschema hook, not for this package, and nothing rewrites it."
    },
    "tag": {
      "type": "string",
      "description": "Tag is the upstream release tag to vendor. It is the pin, and the only copy of it: Vendor\nwrites it into the package's zarf.yaml and into every generated kustomization.",
      "examples": [
        "v2.9.5"
      ]
    },
    "renovate": {
      "type": "string",
      "description": "Renovate is the annotation a Renovate configuration reads to offer a bump of Tag. It is\ncarried from zarf-pkg-fluxcd, where Renovate is wired up; nothing in this repository reads\nit, and moving the pin here is a hand edit followed by `examples:vendor`.",
      "examples": [
        "datasource=github-releases depName=fluxcd/flux2"
      ]
    },
    "repo": {
      "type": "string",
      "description": "Repo is the upstream repository's URL.",
      "examples": [
        "https://github.com/fluxcd/flux2"
      ]
    },
    "asset": {
      "type": "string",
      "description": "Asset is the release asset to download, by name. Exactly one of Asset and Tree is set.",
      "examples": [
        "manifests.tar.gz"
      ]
    },
    "tree": {
      "type": "string",
      "description": "Tree vendors from a directory in the tagged source tree instead of from a release asset,\nand is the directory the project Match paths are relative to.\n\nIt exists because not every upstream attaches its manifests to a release. Flux publishes\nmanifests.tar.gz and this package was written for that; Argo CD attaches only CLI binaries\nand SBOMs, and its own release notes tell you to apply\nraw.githubusercontent.com/argoproj/argo-cd/\u003ctag\u003e/manifests/install.yaml -- a path in the\ntagged tree. Both are a pin to a tag, which is the only property that matters here; the\ndifference is where the bytes are.\n\nThe repository's source archive is not used instead, which would keep one code path: it is\na gzip tar and readArchive flattens entry names to their basename, so a whole repository of\nthousands of files collapses onto a handful of names and trips the clash check. Fetching the\nnamed files is both smaller and exact.",
      "examples": [
        "manifests"
      ]
    },
    "namespace": {
      "type": "string",
      "description": "Namespace is the namespace every generated kustomization places its resources in.",
      "examples": [
        "flux-system",
        "argocd"
      ]
    },
    "partOf": {
      "type": "string",
      "description": "PartOf is the app.kubernetes.io/part-of label every generated kustomization stamps on. It\nis what upstream already sets on most of its own resources, repeated so that every resource\nin the project carries it including the ones that do not today.",
      "examples": [
        "flux",
        "argocd"
      ]
    },
    "registry": {
      "type": "string",
      "description": "Registry re-homes every image the vendored manifests name without one onto this host, as a\nkustomize image transform in the generated kustomization.\n\nUpstream's manifests name their images as `fluxcd/source-controller:v1.9.5`, which resolves\nto Docker Hub -- where an anonymous pull is rate-limited per IP, and a zarf package create\npulls every image in the package at once. The same images are published to ghcr.io, so this\nis the difference between a create that works and a create that fails partway through on a\nshared outbound address. Left empty, the manifests are vendored as they came.",
      "examples": [
        "ghcr.io"
      ]
    },
    "projects": {
      "items": {
        "$ref": "#/$defs/Project"
      },
      "type": "array",
      "description": "Projects are the subdirectories the asset's contents are split into."
    }
  },
  "additionalProperties": false,
  "type": "object",
  "required": [
    "tag",
    "repo",
    "namespace",
    "partOf",
    "projects"
  ],
  "description": "Resources is a package's resources.json: one upstream release, and the projects extracted from it."
}
